{
  "operation": "LZMA",
  "category": "compression",
  "description": "Tests for LZMA compression and decompression operations",
  "tests": [
    {
      "name": "lzma_roundtrip_hello_world",
      "comment": "Test LZMA Compress/Decompress roundtrip with 'Hello, World!'",
      "input": {
        "type": "bytes",
        "encoding": "hex",
        "value": "48656c6c6f2c20576f726c6421"
      },
      "operations": ["LZMA Compress", "LZMA Decompress"],
      "expected": {
        "type": "bytes",
        "encoding": "hex",
        "value": "48656c6c6f2c20576f726c6421"
      },
      "tags": ["compress", "roundtrip"]
    },
    {
      "name": "lzma_roundtrip_empty",
      "comment": "Test LZMA roundtrip with empty input",
      "input": {
        "type": "bytes",
        "encoding": "hex",
        "value": ""
      },
      "operations": ["LZMA Compress", "LZMA Decompress"],
      "expected": {
        "type": "bytes",
        "encoding": "hex",
        "value": ""
      },
      "tags": ["compress", "roundtrip", "empty", "edge-case"]
    },
    {
      "name": "lzma_roundtrip_all_bytes",
      "comment": "Test LZMA roundtrip with all 256 possible byte values",
      "input": {
        "type": "bytes",
        "encoding": "hex",
        "value": "000102030405060708090a0b0c0d0e0f101112131415161718191a1b1c1d1e1f202122232425262728292a2b2c2d2e2f303132333435363738393a3b3c3d3e3f404142434445464748494a4b4c4d4e4f505152535455565758595a5b5c5d5e5f606162636465666768696a6b6c6d6e6f707172737475767778797a7b7c7d7e7f808182838485868788898a8b8c8d8e8f909192939495969798999a9b9c9d9e9fa0a1a2a3a4a5a6a7a8a9aaabacadaeafb0b1b2b3b4b5b6b7b8b9babbbcbdbebfc0c1c2c3c4c5c6c7c8c9cacbcccdcecfd0d1d2d3d4d5d6d7d8d9dadbdcdddedfe0e1e2e3e4e5e6e7e8e9eaebecedeeeff0f1f2f3f4f5f6f7f8f9fafbfcfdfeff"
      },
      "operations": ["LZMA Compress", "LZMA Decompress"],
      "expected": {
        "type": "bytes",
        "encoding": "hex",
        "value": "000102030405060708090a0b0c0d0e0f101112131415161718191a1b1c1d1e1f202122232425262728292a2b2c2d2e2f303132333435363738393a3b3c3d3e3f404142434445464748494a4b4c4d4e4f505152535455565758595a5b5c5d5e5f606162636465666768696a6b6c6d6e6f707172737475767778797a7b7c7d7e7f808182838485868788898a8b8c8d8e8f909192939495969798999a9b9c9d9e9fa0a1a2a3a4a5a6a7a8a9aaabacadaeafb0b1b2b3b4b5b6b7b8b9babbbcbdbebfc0c1c2c3c4c5c6c7c8c9cacbcccdcecfd0d1d2d3d4d5d6d7d8d9dadbdcdddedfe0e1e2e3e4e5e6e7e8e9eaebecedeeeff0f1f2f3f4f5f6f7f8f9fafbfcfdfeff"
      },
      "tags": ["compress", "roundtrip", "binary"]
    },
    {
      "name": "lzma_roundtrip_utf8_simple",
      "comment": "Test LZMA roundtrip with UTF-8 text",
      "input": {
        "type": "bytes",
        "encoding": "hex",
        "value": "48656c6c6f2c20576f726c642120e4bda0e5a5bde4b896e7958c20f09f8c8d"
      },
      "operations": ["LZMA Compress", "LZMA Decompress"],
      "expected": {
        "type": "bytes",
        "encoding": "hex",
        "value": "48656c6c6f2c20576f726c642120e4bda0e5a5bde4b896e7958c20f09f8c8d"
      },
      "tags": ["compress", "roundtrip", "utf8"]
    },
    {
      "name": "lzma_roundtrip_utf8_emoji",
      "comment": "Test LZMA roundtrip with UTF-8 emoji",
      "input": {
        "type": "bytes",
        "encoding": "hex",
        "value": "f09f8e89f09f9a80f09f92bbf09f94a5e2ad90"
      },
      "operations": ["LZMA Compress", "LZMA Decompress"],
      "expected": {
        "type": "bytes",
        "encoding": "hex",
        "value": "f09f8e89f09f9a80f09f92bbf09f94a5e2ad90"
      },
      "tags": ["compress", "roundtrip", "utf8"]
    },
    {
      "name": "lzma_roundtrip_utf8_multilang",
      "comment": "Test LZMA roundtrip with UTF-8 multilingual text",
      "input": {
        "type": "bytes",
        "encoding": "hex",
        "value": "48656c6c6f20d985d8b1d8add8a8d8a720e38193e38293e381abe381a1e381af20ec9588eb8595ed9598ec84b8ec9a9420d09fd180d0b8d0b2d0b5d182"
      },
      "operations": ["LZMA Compress", "LZMA Decompress"],
      "expected": {
        "type": "bytes",
        "encoding": "hex",
        "value": "48656c6c6f20d985d8b1d8add8a8d8a720e38193e38293e381abe381a1e381af20ec9588eb8595ed9598ec84b8ec9a9420d09fd180d0b8d0b2d0b5d182"
      },
      "tags": ["compress", "roundtrip", "utf8"]
    },
    {
      "name": "lzma_compression_mode_1",
      "comment": "Test LZMA with compression mode 1 (fastest) and verify decompression",
      "input": {
        "type": "bytes",
        "encoding": "hex",
        "value": "48656c6c6f20576f726c64212048656c6c6f20576f726c64212048656c6c6f20576f726c642021"
      },
      "operations": [
        {
          "op": "LZMA Compress",
          "args": {
            "Compression Mode": 1
          }
        },
        "LZMA Decompress"
      ],
      "expected": {
        "type": "bytes",
        "encoding": "hex",
        "value": "48656c6c6f20576f726c64212048656c6c6f20576f726c64212048656c6c6f20576f726c642021"
      },
      "tags": ["compress", "roundtrip", "compression-options"]
    },
    {
      "name": "lzma_compression_mode_5",
      "comment": "Test LZMA with compression mode 5 (balanced) and verify decompression",
      "input": {
        "type": "bytes",
        "encoding": "hex",
        "value": "48656c6c6f20576f726c64212048656c6c6f20576f726c64212048656c6c6f20576f726c642021"
      },
      "operations": [
        {
          "op": "LZMA Compress",
          "args": {
            "Compression Mode": 5
          }
        },
        "LZMA Decompress"
      ],
      "expected": {
        "type": "bytes",
        "encoding": "hex",
        "value": "48656c6c6f20576f726c64212048656c6c6f20576f726c64212048656c6c6f20576f726c642021"
      },
      "tags": ["compress", "roundtrip", "compression-options"]
    },
    {
      "name": "lzma_compression_mode_9",
      "comment": "Test LZMA with compression mode 9 (maximum) and verify decompression",
      "input": {
        "type": "bytes",
        "encoding": "hex",
        "value": "48656c6c6f20576f726c64212048656c6c6f20576f726c64212048656c6c6f20576f726c642021"
      },
      "operations": [
        {
          "op": "LZMA Compress",
          "args": {
            "Compression Mode": 9
          }
        },
        "LZMA Decompress"
      ],
      "expected": {
        "type": "bytes",
        "encoding": "hex",
        "value": "48656c6c6f20576f726c64212048656c6c6f20576f726c64212048656c6c6f20576f726c642021"
      },
      "tags": ["compress", "roundtrip", "compression-options"]
    }
  ]
}
